{
  "schemaVersion": 1,
  "cefr": "C1",
  "pos": "phrasal_verb",
  "entries": [
    { "id": "abzeichnen_verb", "cefr": "C1", "pos": "phrasal_verb", "lemma_de": "sich abzeichnen", "translations_en": ["to become apparent", "to loom"], "example_de": "Ein neuer Trend zeichnet sich ab.", "example_en": "A new trend is becoming apparent.", "cloze_word": "ab", "themes": ["abstract_ideas"], "priority": 2, "verb": { "separable": true, "irregular": false, "present_3sg": "zeichnet sich ... ab", "perfekt": "hat sich abgezeichnet", "praeteritum_3sg": null, "base_verb": "zeichnen_verb", "particle": "ab", "particle_meaning_hint": "ab = off/away — a shape drawing itself into view" } },
    { "id": "hervorgehen_verb", "cefr": "C1", "pos": "phrasal_verb", "lemma_de": "hervorgehen", "translations_en": ["to emerge (from)", "to follow (from)"], "example_de": "Aus der Ehe gingen drei Kinder hervor.", "example_en": "Three children emerged from the marriage.", "cloze_word": "hervor", "themes": ["argumentation"], "priority": 3, "verb": { "separable": true, "irregular": true, "present_3sg": "geht ... hervor", "perfekt": "ist hervorgegangen", "praeteritum_3sg": null, "base_verb": "gehen_verb", "particle": "hervor", "particle_meaning_hint": "hervor = forth — emerging out of something" } },
    { "id": "einhergehen_verb", "cefr": "C1", "pos": "phrasal_verb", "lemma_de": "einhergehen", "translations_en": ["to go along with", "to be accompanied by"], "example_de": "Der Erfolg geht oft mit viel Arbeit einher.", "example_en": "Success often goes hand in hand with a lot of work.", "cloze_word": "einher", "themes": ["abstract_ideas"], "priority": 2, "verb": { "separable": true, "irregular": true, "present_3sg": "geht ... einher", "perfekt": "ist einhergegangen", "praeteritum_3sg": null, "base_verb": "gehen_verb", "particle": "einher", "particle_meaning_hint": "einher = along — going along side by side with something" } },
    { "id": "vorausgehen_verb", "cefr": "C1", "pos": "phrasal_verb", "lemma_de": "vorausgehen", "translations_en": ["to precede"], "example_de": "Der Diskussion ging eine lange Vorbereitung voraus.", "example_en": "The discussion was preceded by a long preparation.", "cloze_word": "voraus", "themes": ["abstract_ideas"], "priority": 3, "verb": { "separable": true, "irregular": true, "present_3sg": "geht ... voraus", "perfekt": "ist vorausgegangen", "praeteritum_3sg": null, "base_verb": "gehen_verb", "particle": "voraus", "particle_meaning_hint": "voraus = ahead — going ahead of something else" } },
    { "id": "auseinanderhalten_verb", "cefr": "C1", "pos": "phrasal_verb", "lemma_de": "auseinanderhalten", "translations_en": ["to distinguish", "to tell apart"], "example_de": "Ich kann die Zwillinge nicht auseinanderhalten.", "example_en": "I can't tell the twins apart.", "cloze_word": "auseinander", "themes": ["abstract_ideas"], "priority": 2, "verb": { "separable": true, "irregular": true, "present_3sg": "hält ... auseinander", "perfekt": "hat auseinandergehalten", "praeteritum_3sg": null, "base_verb": "halten_verb", "particle": "auseinander", "particle_meaning_hint": "auseinander = apart — holding two things mentally apart" } },
    { "id": "zugrundeliegen_verb", "cefr": "C1", "pos": "phrasal_verb", "lemma_de": "zugrundeliegen", "translations_en": ["to underlie", "to be the basis of"], "example_de": "Der Entscheidung liegt eine lange Analyse zugrunde.", "example_en": "A long analysis underlies the decision.", "cloze_word": "zugrunde", "themes": ["argumentation"], "priority": 3, "verb": { "separable": true, "irregular": true, "present_3sg": "liegt ... zugrunde", "perfekt": "hat zugrundegelegen", "praeteritum_3sg": null, "base_verb": "liegen_verb", "particle": "zugrunde", "particle_meaning_hint": "zugrunde = at the base/bottom — lying at the foundation of something" } }
  ]
}
