{
  "schemaVersion": 1,
  "cefr": "B1",
  "pos": "noun",
  "entries": [
    { "id": "erfahrung_noun", "cefr": "B1", "pos": "noun", "lemma_de": "Erfahrung", "translations_en": ["experience"], "example_de": "Sie hat viel Erfahrung in diesem Bereich.", "example_en": "She has a lot of experience in this field.", "cloze_word": "Erfahrung", "themes": ["abstract_ideas"], "priority": 1, "noun": { "gender": "die", "plural_de": "Erfahrungen" } },
    { "id": "entscheidung_noun", "cefr": "B1", "pos": "noun", "lemma_de": "Entscheidung", "translations_en": ["decision"], "example_de": "Das war eine schwierige Entscheidung.", "example_en": "That was a difficult decision.", "cloze_word": "Entscheidung", "themes": ["abstract_ideas"], "priority": 1, "noun": { "gender": "die", "plural_de": "Entscheidungen" } },
    { "id": "eindruck_noun", "cefr": "B1", "pos": "noun", "lemma_de": "Eindruck", "translations_en": ["impression"], "example_de": "Er hat einen guten Eindruck gemacht.", "example_en": "He made a good impression.", "cloze_word": "Eindruck", "themes": ["abstract_ideas"], "priority": 2, "noun": { "gender": "der", "plural_de": "Eindrücke" } },
    { "id": "verantwortung_noun", "cefr": "B1", "pos": "noun", "lemma_de": "Verantwortung", "translations_en": ["responsibility"], "example_de": "Sie übernimmt die Verantwortung für das Projekt.", "example_en": "She is taking responsibility for the project.", "cloze_word": "Verantwortung", "themes": ["work"], "priority": 2, "noun": { "gender": "die", "plural_de": null } },
    { "id": "umwelt_noun", "cefr": "B1", "pos": "noun", "lemma_de": "Umwelt", "translations_en": ["environment"], "example_de": "Wir müssen die Umwelt schützen.", "example_en": "We must protect the environment.", "cloze_word": "Umwelt", "themes": ["nature"], "priority": 1, "noun": { "gender": "die", "plural_de": null } },
    { "id": "vorschlag_noun", "cefr": "B1", "pos": "noun", "lemma_de": "Vorschlag", "translations_en": ["suggestion", "proposal"], "example_de": "Das ist ein guter Vorschlag.", "example_en": "That's a good suggestion.", "cloze_word": "Vorschlag", "themes": ["work"], "priority": 2, "noun": { "gender": "der", "plural_de": "Vorschläge" } },
    { "id": "beziehung_noun", "cefr": "B1", "pos": "noun", "lemma_de": "Beziehung", "translations_en": ["relationship"], "example_de": "Sie führen eine lange Beziehung.", "example_en": "They are in a long relationship.", "cloze_word": "Beziehung", "themes": ["people"], "priority": 1, "noun": { "gender": "die", "plural_de": "Beziehungen" } },
    { "id": "unterschied_noun", "cefr": "B1", "pos": "noun", "lemma_de": "Unterschied", "translations_en": ["difference"], "example_de": "Es gibt einen großen Unterschied zwischen den beiden.", "example_en": "There is a big difference between the two.", "cloze_word": "Unterschied", "themes": ["abstract_ideas"], "priority": 1, "noun": { "gender": "der", "plural_de": "Unterschiede" } },
    { "id": "ereignis_noun", "cefr": "B1", "pos": "noun", "lemma_de": "Ereignis", "translations_en": ["event"], "example_de": "Die Hochzeit war ein besonderes Ereignis.", "example_en": "The wedding was a special event.", "cloze_word": "Ereignis", "themes": ["abstract_ideas"], "priority": 2, "noun": { "gender": "das", "plural_de": "Ereignisse" } },
    { "id": "moeglichkeit_noun", "cefr": "B1", "pos": "noun", "lemma_de": "Möglichkeit", "translations_en": ["possibility", "option"], "example_de": "Es gibt mehrere Möglichkeiten.", "example_en": "There are several possibilities.", "cloze_word": "Möglichkeiten", "themes": ["abstract_ideas"], "priority": 1, "noun": { "gender": "die", "plural_de": "Möglichkeiten" } }
  ]
}
