{
  "schemaVersion": 1,
  "cefr": "C2",
  "pos": "phrasal_verb",
  "entries": [
    { "id": "hinwegsetzen_verb", "cefr": "C2", "pos": "phrasal_verb", "lemma_de": "sich hinwegsetzen", "translations_en": ["to disregard", "to override"], "example_de": "Er setzt sich über alle Regeln hinweg.", "example_en": "He disregards all the rules.", "cloze_word": "hinweg", "themes": ["society"], "priority": 3, "verb": { "separable": true, "irregular": false, "present_3sg": "setzt sich ... hinweg", "perfekt": "hat sich hinweggesetzt", "praeteritum_3sg": null, "base_verb": "setzen_verb", "particle": "hinweg", "particle_meaning_hint": "hinweg = over/across — setting oneself over the rules" } },
    { "id": "aufrechterhalten_verb", "cefr": "C2", "pos": "phrasal_verb", "lemma_de": "aufrechterhalten", "translations_en": ["to maintain", "to uphold"], "example_de": "Die Firma will das Angebot aufrechterhalten.", "example_en": "The company wants to maintain the offer.", "cloze_word": "aufrecht", "themes": ["work"], "priority": 3, "verb": { "separable": true, "irregular": true, "present_3sg": "erhält ... aufrecht", "perfekt": "hat aufrechterhalten", "praeteritum_3sg": null, "base_verb": "erhalten_verb", "particle": "aufrecht", "particle_meaning_hint": "aufrecht = upright — keeping something standing upright" } },
    { "id": "zutagetreten_verb", "cefr": "C2", "pos": "phrasal_verb", "lemma_de": "zutagetreten", "translations_en": ["to come to light", "to emerge"], "example_de": "Die Probleme traten erst später zutage.", "example_en": "The problems only came to light later.", "cloze_word": "zutage", "themes": ["abstract_ideas"], "priority": 4, "verb": { "separable": true, "irregular": true, "present_3sg": "tritt ... zutage", "perfekt": "ist zutagegetreten", "praeteritum_3sg": null, "base_verb": "treten_verb", "particle": "zutage", "particle_meaning_hint": "zutage = to light/into the open — stepping out into visibility" } },
    { "id": "abfinden_verb", "cefr": "C2", "pos": "phrasal_verb", "lemma_de": "sich abfinden", "translations_en": ["to come to terms with", "to accept"], "example_de": "Sie musste sich mit der Situation abfinden.", "example_en": "She had to come to terms with the situation.", "cloze_word": "ab", "themes": ["emotions"], "priority": 2, "verb": { "separable": true, "irregular": true, "present_3sg": "findet sich ... ab", "perfekt": "hat sich abgefunden", "praeteritum_3sg": null, "base_verb": "finden_verb", "particle": "ab", "particle_meaning_hint": "ab = off/away — settling a matter and letting it go" } },
    { "id": "hinausgehen_verb", "cefr": "C2", "pos": "phrasal_verb", "lemma_de": "hinausgehen", "translations_en": ["to go beyond", "to exceed"], "example_de": "Das geht über meine Kompetenzen hinaus.", "example_en": "That goes beyond my competencies.", "cloze_word": "hinaus", "themes": ["abstract_ideas"], "priority": 2, "verb": { "separable": true, "irregular": true, "present_3sg": "geht ... hinaus", "perfekt": "ist hinausgegangen", "praeteritum_3sg": null, "base_verb": "gehen_verb", "particle": "hinaus", "particle_meaning_hint": "hinaus = out/beyond" } },
    { "id": "niederschlagen_verb", "cefr": "C2", "pos": "phrasal_verb", "lemma_de": "sich niederschlagen", "translations_en": ["to be reflected in", "to manifest as"], "example_de": "Der Stress schlägt sich in seiner Gesundheit nieder.", "example_en": "The stress is reflected in his health.", "cloze_word": "nieder", "themes": ["abstract_ideas"], "priority": 3, "verb": { "separable": true, "irregular": true, "present_3sg": "schlägt sich ... nieder", "perfekt": "hat sich niedergeschlagen", "praeteritum_3sg": null, "base_verb": "schlagen_verb", "particle": "nieder", "particle_meaning_hint": "nieder = down — settling down into a visible form" } }
  ]
}
