{
  "schemaVersion": 1,
  "cefr": "B1",
  "pos": "phrasal_verb",
  "entries": [
    { "id": "vorschlagen_verb", "cefr": "B1", "pos": "phrasal_verb", "lemma_de": "vorschlagen", "translations_en": ["to suggest", "to propose"], "example_de": "Ich schlage vor, dass wir uns morgen treffen.", "example_en": "I suggest that we meet tomorrow.", "cloze_word": "vor", "themes": ["work"], "priority": 1, "verb": { "separable": true, "irregular": true, "present_3sg": "schlägt ... vor", "perfekt": "hat vorgeschlagen", "praeteritum_3sg": null, "base_verb": "schlagen_verb", "particle": "vor", "particle_meaning_hint": "vor = forward/forth — putting an idea forward" } },
    { "id": "teilnehmen_verb", "cefr": "B1", "pos": "phrasal_verb", "lemma_de": "teilnehmen", "translations_en": ["to participate", "to take part"], "example_de": "Sie nimmt an dem Kurs teil.", "example_en": "She is taking part in the course.", "cloze_word": "teil", "themes": ["education"], "priority": 1, "verb": { "separable": true, "irregular": true, "present_3sg": "nimmt ... teil", "perfekt": "hat teilgenommen", "praeteritum_3sg": null, "base_verb": "nehmen_verb", "particle": "teil", "particle_meaning_hint": "teil = part — taking a part in something" } },
    { "id": "stattfinden_verb", "cefr": "B1", "pos": "phrasal_verb", "lemma_de": "stattfinden", "translations_en": ["to take place"], "example_de": "Die Konferenz findet nächste Woche statt.", "example_en": "The conference takes place next week.", "cloze_word": "statt", "themes": ["work"], "priority": 1, "verb": { "separable": true, "irregular": true, "present_3sg": "findet ... statt", "perfekt": "hat stattgefunden", "praeteritum_3sg": null, "base_verb": "finden_verb", "particle": "statt", "particle_meaning_hint": "statt = instead of / in place of — an event finding its place" } },
    { "id": "zurueckkommen_verb", "cefr": "B1", "pos": "phrasal_verb", "lemma_de": "zurückkommen", "translations_en": ["to come back", "to return"], "example_de": "Er kommt morgen aus dem Urlaub zurück.", "example_en": "He is coming back from vacation tomorrow.", "cloze_word": "zurück", "themes": ["travel"], "priority": 2, "verb": { "separable": true, "irregular": true, "present_3sg": "kommt ... zurück", "perfekt": "ist zurückgekommen", "praeteritum_3sg": null, "base_verb": "kommen_verb", "particle": "zurück", "particle_meaning_hint": "zurück = back" } },
    { "id": "aufgeben_verb", "cefr": "B1", "pos": "phrasal_verb", "lemma_de": "aufgeben", "translations_en": ["to give up"], "example_de": "Gib nicht so schnell auf!", "example_en": "Don't give up so quickly!", "cloze_word": "auf", "themes": ["emotions"], "priority": 2, "verb": { "separable": true, "irregular": true, "present_3sg": "gibt ... auf", "perfekt": "hat aufgegeben", "praeteritum_3sg": null, "base_verb": "geben_verb", "particle": "auf", "particle_meaning_hint": "auf = up — giving something up" } },
    { "id": "umziehen_verb", "cefr": "B1", "pos": "phrasal_verb", "lemma_de": "umziehen", "translations_en": ["to move house", "to relocate"], "example_de": "Wir ziehen nächsten Monat um.", "example_en": "We're moving next month.", "cloze_word": "um", "themes": ["home"], "priority": 2, "verb": { "separable": true, "irregular": true, "present_3sg": "zieht ... um", "perfekt": "ist umgezogen", "praeteritum_3sg": null, "base_verb": "ziehen_verb", "particle": "um", "particle_meaning_hint": "um = around — moving your life around to a new place" } }
  ]
}
