{
  "schemaVersion": 1,
  "cefr": "C1",
  "pos": "composite_verb",
  "entries": [
    { "id": "wiedergeben_verb", "cefr": "C1", "pos": "composite_verb", "lemma_de": "wiedergeben", "translations_en": ["to reproduce", "to render", "to convey"], "example_de": "Er gibt die Ereignisse genau wieder.", "example_en": "He renders the events accurately.", "cloze_word": "wieder", "themes": ["communication"], "priority": 3, "verb": { "separable": true, "irregular": true, "present_3sg": "gibt ... wieder", "perfekt": "hat wiedergegeben", "praeteritum_3sg": null, "base_verb": "geben_verb", "particle": "wieder", "particle_meaning_hint": "wieder = again/back — giving something back out in another form" } },
    { "id": "gleichsetzen_verb", "cefr": "C1", "pos": "composite_verb", "lemma_de": "gleichsetzen", "translations_en": ["to equate"], "example_de": "Man sollte Meinung nicht mit Fakten gleichsetzen.", "example_en": "One shouldn't equate opinion with facts.", "cloze_word": "gleich", "themes": ["argumentation"], "priority": 3, "verb": { "separable": true, "irregular": false, "present_3sg": "setzt ... gleich", "perfekt": "hat gleichgesetzt", "praeteritum_3sg": null, "base_verb": "setzen_verb", "particle": "gleich", "particle_meaning_hint": "gleich = equal — setting two things as equal" } },
    { "id": "vorwegnehmen_verb", "cefr": "C1", "pos": "composite_verb", "lemma_de": "vorwegnehmen", "translations_en": ["to anticipate", "to preempt"], "example_de": "Der Trailer nimmt die besten Szenen vorweg.", "example_en": "The trailer gives away the best scenes in advance.", "cloze_word": "vorweg", "themes": ["argumentation"], "priority": 4, "verb": { "separable": true, "irregular": true, "present_3sg": "nimmt ... vorweg", "perfekt": "hat vorweggenommen", "praeteritum_3sg": null, "base_verb": "nehmen_verb", "particle": "vorweg", "particle_meaning_hint": "vorweg = beforehand — taking something before its time" } },
    { "id": "infragestellen_verb", "cefr": "C1", "pos": "composite_verb", "lemma_de": "infragestellen", "translations_en": ["to call into question", "to question"], "example_de": "Niemand stellt seine Kompetenz infrage.", "example_en": "No one questions his competence.", "cloze_word": "infrage", "themes": ["argumentation"], "priority": 2, "verb": { "separable": true, "irregular": false, "present_3sg": "stellt ... infrage", "perfekt": "hat infrage gestellt", "praeteritum_3sg": null, "base_verb": "stellen_verb", "particle": "infrage", "particle_meaning_hint": "infrage = into question — putting something up for doubt" } }
  ]
}
