{
  "schemaVersion": 1,
  "cefr": "B2",
  "pos": "phrasal_verb",
  "entries": [
    { "id": "auseinandersetzen_verb", "cefr": "B2", "pos": "phrasal_verb", "lemma_de": "sich auseinandersetzen", "translations_en": ["to deal with", "to engage with"], "example_de": "Er setzt sich intensiv mit dem Thema auseinander.", "example_en": "He engages intensively with the topic.", "cloze_word": "auseinander", "themes": ["argumentation"], "priority": 1, "verb": { "separable": true, "irregular": false, "present_3sg": "setzt sich ... auseinander", "perfekt": "hat sich auseinandergesetzt", "praeteritum_3sg": null, "base_verb": "setzen_verb", "particle": "auseinander", "particle_meaning_hint": "auseinander = apart — engaging closely and taking something apart mentally" } },
    { "id": "zurueckfuehren_verb", "cefr": "B2", "pos": "phrasal_verb", "lemma_de": "zurückführen", "translations_en": ["to attribute to", "to trace back to"], "example_de": "Sie führt den Erfolg auf harte Arbeit zurück.", "example_en": "She attributes the success to hard work.", "cloze_word": "zurück", "themes": ["argumentation"], "priority": 2, "verb": { "separable": true, "irregular": false, "present_3sg": "führt ... zurück", "perfekt": "hat zurückgeführt", "praeteritum_3sg": null, "base_verb": "fuehren_verb", "particle": "zurück", "particle_meaning_hint": "zurück = back — tracing something back to its cause" } },
    { "id": "hervorheben_verb", "cefr": "B2", "pos": "phrasal_verb", "lemma_de": "hervorheben", "translations_en": ["to emphasize", "to highlight"], "example_de": "Der Bericht hebt die Vorteile hervor.", "example_en": "The report highlights the advantages.", "cloze_word": "hervor", "themes": ["communication"], "priority": 2, "verb": { "separable": true, "irregular": true, "present_3sg": "hebt ... hervor", "perfekt": "hat hervorgehoben", "praeteritum_3sg": null, "base_verb": "heben_verb", "particle": "hervor", "particle_meaning_hint": "hervor = forth/out — bringing something to prominence" } },
    { "id": "durchsetzen_verb", "cefr": "B2", "pos": "phrasal_verb", "lemma_de": "durchsetzen", "translations_en": ["to enforce", "to prevail"], "example_de": "Die Regierung konnte das Gesetz durchsetzen.", "example_en": "The government managed to enforce the law.", "cloze_word": "durch", "themes": ["society"], "priority": 2, "verb": { "separable": true, "irregular": false, "present_3sg": "setzt ... durch", "perfekt": "hat durchgesetzt", "praeteritum_3sg": null, "base_verb": "setzen_verb", "particle": "durch", "particle_meaning_hint": "durch = through — pushing something through to success" } },
    { "id": "auffallen_verb", "cefr": "B2", "pos": "phrasal_verb", "lemma_de": "auffallen", "translations_en": ["to stand out", "to be noticeable"], "example_de": "Ihr Talent ist sofort aufgefallen.", "example_en": "Her talent stood out immediately.", "cloze_word": "auf", "themes": ["abstract_ideas"], "priority": 2, "verb": { "separable": true, "irregular": true, "present_3sg": "fällt ... auf", "perfekt": "ist aufgefallen", "praeteritum_3sg": null, "base_verb": "fallen_verb", "particle": "auf", "particle_meaning_hint": "auf = up/out — falling into notice, standing out" } },
    { "id": "vorkommen_verb", "cefr": "B2", "pos": "phrasal_verb", "lemma_de": "vorkommen", "translations_en": ["to occur", "to happen"], "example_de": "So etwas kommt selten vor.", "example_en": "Something like that rarely happens.", "cloze_word": "vor", "themes": ["abstract_ideas"], "priority": 2, "verb": { "separable": true, "irregular": true, "present_3sg": "kommt ... vor", "perfekt": "ist vorgekommen", "praeteritum_3sg": null, "base_verb": "kommen_verb", "particle": "vor", "particle_meaning_hint": "vor = before/forth — something coming forth, occurring" } }
  ]
}
