{
  "schemaVersion": 1,
  "cefr": "C2",
  "pos": "verb",
  "entries": [
    { "id": "relativieren_verb", "cefr": "C2", "pos": "verb", "lemma_de": "relativieren", "translations_en": ["to put into perspective", "to qualify"], "example_de": "Er wollte seine Aussage relativieren.", "example_en": "He wanted to qualify his statement.", "cloze_word": "relativieren", "themes": ["argumentation"], "priority": 3, "verb": { "separable": false, "irregular": false, "present_3sg": "relativiert", "perfekt": "hat relativiert", "praeteritum_3sg": null, "base_verb": null, "particle": null, "particle_meaning_hint": null } },
    { "id": "suggerieren_verb", "cefr": "C2", "pos": "verb", "lemma_de": "suggerieren", "translations_en": ["to suggest", "to imply"], "example_de": "Die Werbung suggeriert ein perfektes Leben.", "example_en": "The advertisement suggests a perfect life.", "cloze_word": "suggeriert", "themes": ["communication"], "priority": 2, "verb": { "separable": false, "irregular": false, "present_3sg": "suggeriert", "perfekt": "hat suggeriert", "praeteritum_3sg": null, "base_verb": null, "particle": null, "particle_meaning_hint": null } },
    { "id": "instrumentalisieren_verb", "cefr": "C2", "pos": "verb", "lemma_de": "instrumentalisieren", "translations_en": ["to instrumentalize", "to exploit (for a purpose)"], "example_de": "Die Politiker instrumentalisieren das Thema für ihre Zwecke.", "example_en": "The politicians instrumentalize the topic for their own purposes.", "cloze_word": "instrumentalisieren", "themes": ["society"], "priority": 4, "verb": { "separable": false, "irregular": false, "present_3sg": "instrumentalisiert", "perfekt": "hat instrumentalisiert", "praeteritum_3sg": null, "base_verb": null, "particle": null, "particle_meaning_hint": null } },
    { "id": "nivellieren_verb", "cefr": "C2", "pos": "verb", "lemma_de": "nivellieren", "translations_en": ["to level out", "to homogenize"], "example_de": "Der Test nivelliert die Unterschiede zwischen den Schülern.", "example_en": "The test levels out the differences between the students.", "cloze_word": "nivelliert", "themes": ["society"], "priority": 4, "verb": { "separable": false, "irregular": false, "present_3sg": "nivelliert", "perfekt": "hat nivelliert", "praeteritum_3sg": null, "base_verb": null, "particle": null, "particle_meaning_hint": null } },
    { "id": "kaschieren_verb", "cefr": "C2", "pos": "verb", "lemma_de": "kaschieren", "translations_en": ["to conceal", "to mask", "to disguise"], "example_de": "Sie versuchte, ihre Nervosität zu kaschieren.", "example_en": "She tried to conceal her nervousness.", "cloze_word": "kaschieren", "themes": ["communication"], "priority": 3, "verb": { "separable": false, "irregular": false, "present_3sg": "kaschiert", "perfekt": "hat kaschiert", "praeteritum_3sg": null, "base_verb": null, "particle": null, "particle_meaning_hint": null } },
    { "id": "verharmlosen_verb", "cefr": "C2", "pos": "verb", "lemma_de": "verharmlosen", "translations_en": ["to downplay", "to trivialize"], "example_de": "Man sollte die Gefahr nicht verharmlosen.", "example_en": "One shouldn't downplay the danger.", "cloze_word": "verharmlosen", "themes": ["communication"], "priority": 3, "verb": { "separable": false, "irregular": false, "present_3sg": "verharmlost", "perfekt": "hat verharmlost", "praeteritum_3sg": null, "base_verb": null, "particle": null, "particle_meaning_hint": null } }
  ]
}
