{
  "schemaVersion": 1,
  "cefr": "C2",
  "pos": "noun",
  "entries": [
    { "id": "traegheit_noun", "cefr": "C2", "pos": "noun", "lemma_de": "Trägheit", "translations_en": ["inertia", "sluggishness"], "example_de": "Die Trägheit des Systems verhindert schnelle Änderungen.", "example_en": "The inertia of the system prevents quick changes.", "cloze_word": "Trägheit", "themes": ["abstract_ideas"], "priority": 3, "noun": { "gender": "die", "plural_de": null } },
    { "id": "ambivalenz_noun", "cefr": "C2", "pos": "noun", "lemma_de": "Ambivalenz", "translations_en": ["ambivalence"], "example_de": "Seine Ambivalenz gegenüber der Entscheidung war spürbar.", "example_en": "His ambivalence towards the decision was palpable.", "cloze_word": "Ambivalenz", "themes": ["emotions"], "priority": 3, "noun": { "gender": "die", "plural_de": null } },
    { "id": "vorbehalt_noun", "cefr": "C2", "pos": "noun", "lemma_de": "Vorbehalt", "translations_en": ["reservation", "proviso"], "example_de": "Ich stimme dem nur mit Vorbehalt zu.", "example_en": "I only agree to this with reservations.", "cloze_word": "Vorbehalt", "themes": ["argumentation"], "priority": 3, "noun": { "gender": "der", "plural_de": "Vorbehalte" } },
    { "id": "nuance_noun", "cefr": "C2", "pos": "noun", "lemma_de": "Nuance", "translations_en": ["nuance"], "example_de": "Er versteht die feinen Nuancen der Sprache.", "example_en": "He understands the fine nuances of the language.", "cloze_word": "Nuancen", "themes": ["communication"], "priority": 2, "noun": { "gender": "die", "plural_de": "Nuancen" } },
    { "id": "beharrlichkeit_noun", "cefr": "C2", "pos": "noun", "lemma_de": "Beharrlichkeit", "translations_en": ["persistence", "perseverance"], "example_de": "Mit Beharrlichkeit erreichte sie ihr Ziel.", "example_en": "With persistence, she achieved her goal.", "cloze_word": "Beharrlichkeit", "themes": ["emotions"], "priority": 3, "noun": { "gender": "die", "plural_de": null } },
    { "id": "missstand_noun", "cefr": "C2", "pos": "noun", "lemma_de": "Missstand", "translations_en": ["grievance", "abuse", "deplorable state"], "example_de": "Die Reportage deckt einen Missstand auf.", "example_en": "The report exposes a grievance.", "cloze_word": "Missstand", "themes": ["society"], "priority": 3, "noun": { "gender": "der", "plural_de": "Missstände" } },
    { "id": "tragweite_noun", "cefr": "C2", "pos": "noun", "lemma_de": "Tragweite", "translations_en": ["scope", "significance", "magnitude"], "example_de": "Er verstand die Tragweite seiner Entscheidung nicht.", "example_en": "He didn't understand the significance of his decision.", "cloze_word": "Tragweite", "themes": ["abstract_ideas"], "priority": 3, "noun": { "gender": "die", "plural_de": null } },
    { "id": "dilemma_noun", "cefr": "C2", "pos": "noun", "lemma_de": "Dilemma", "translations_en": ["dilemma"], "example_de": "Sie steckt in einem echten Dilemma.", "example_en": "She is in a real dilemma.", "cloze_word": "Dilemma", "themes": ["abstract_ideas"], "priority": 2, "noun": { "gender": "das", "plural_de": "Dilemmata" } },
    { "id": "unzulaenglichkeit_noun", "cefr": "C2", "pos": "noun", "lemma_de": "Unzulänglichkeit", "translations_en": ["inadequacy", "shortcoming"], "example_de": "Das System hat einige Unzulänglichkeiten.", "example_en": "The system has some inadequacies.", "cloze_word": "Unzulänglichkeiten", "themes": ["abstract_ideas"], "priority": 4, "noun": { "gender": "die", "plural_de": "Unzulänglichkeiten" } },
    { "id": "doppeldeutigkeit_noun", "cefr": "C2", "pos": "noun", "lemma_de": "Doppeldeutigkeit", "translations_en": ["ambiguity", "double meaning"], "example_de": "Der Satz enthält eine bewusste Doppeldeutigkeit.", "example_en": "The sentence contains a deliberate ambiguity.", "cloze_word": "Doppeldeutigkeit", "themes": ["communication"], "priority": 4, "noun": { "gender": "die", "plural_de": "Doppeldeutigkeiten" } }
  ]
}
