{
  "schemaVersion": 1,
  "cefr": "A2",
  "pos": "verb",
  "entries": [
    {
      "id": "geben_verb",
      "cefr": "A2",
      "pos": "verb",
      "lemma_de": "geben",
      "translations_en": ["to give"],
      "example_de": "Er gibt mir das Buch.",
      "example_en": "He gives me the book.",
      "cloze_word": "gibt",
      "themes": ["daily_routine"],
      "priority": 1,
      "verb": { "separable": false, "irregular": true, "present_3sg": "gibt", "perfekt": "hat gegeben", "praeteritum_3sg": "gab", "base_verb": null, "particle": null, "particle_meaning_hint": null }
    },
    {
      "id": "nehmen_verb",
      "cefr": "A2",
      "pos": "verb",
      "lemma_de": "nehmen",
      "translations_en": ["to take"],
      "example_de": "Sie nimmt den Bus zur Arbeit.",
      "example_en": "She takes the bus to work.",
      "cloze_word": "nimmt",
      "themes": ["daily_routine"],
      "priority": 1,
      "verb": { "separable": false, "irregular": true, "present_3sg": "nimmt", "perfekt": "hat genommen", "praeteritum_3sg": "nahm", "base_verb": null, "particle": null, "particle_meaning_hint": null }
    },
    {
      "id": "kommen_verb",
      "cefr": "A2",
      "pos": "verb",
      "lemma_de": "kommen",
      "translations_en": ["to come"],
      "example_de": "Er kommt aus Deutschland.",
      "example_en": "He comes from Germany.",
      "cloze_word": "kommt",
      "themes": ["people"],
      "priority": 1,
      "verb": { "separable": false, "irregular": true, "present_3sg": "kommt", "perfekt": "ist gekommen", "praeteritum_3sg": "kam", "base_verb": null, "particle": null, "particle_meaning_hint": null }
    },
    {
      "id": "setzen_verb",
      "cefr": "A2",
      "pos": "verb",
      "lemma_de": "setzen",
      "translations_en": ["to put, to set", "sich setzen: to sit down"],
      "example_de": "Bitte setzen Sie sich.",
      "example_en": "Please sit down.",
      "cloze_word": "setzen",
      "themes": ["daily_routine"],
      "priority": 1,
      "verb": { "separable": false, "irregular": false, "present_3sg": "setzt", "perfekt": "hat gesetzt", "praeteritum_3sg": null, "base_verb": null, "particle": null, "particle_meaning_hint": null }
    },
    {
      "id": "finden_verb",
      "cefr": "A2",
      "pos": "verb",
      "lemma_de": "finden",
      "translations_en": ["to find"],
      "example_de": "Ich finde meine Schlüssel nicht.",
      "example_en": "I can't find my keys.",
      "cloze_word": "finde",
      "themes": ["daily_routine"],
      "priority": 1,
      "verb": { "separable": false, "irregular": true, "present_3sg": "findet", "perfekt": "hat gefunden", "praeteritum_3sg": "fand", "base_verb": null, "particle": null, "particle_meaning_hint": null }
    },
    {
      "id": "lassen_verb",
      "cefr": "A2",
      "pos": "verb",
      "lemma_de": "lassen",
      "translations_en": ["to let", "to leave"],
      "example_de": "Lass mich in Ruhe.",
      "example_en": "Leave me alone.",
      "cloze_word": "Lass",
      "themes": ["daily_routine"],
      "priority": 1,
      "verb": { "separable": false, "irregular": true, "present_3sg": "lässt", "perfekt": "hat gelassen", "praeteritum_3sg": "ließ", "base_verb": null, "particle": null, "particle_meaning_hint": null }
    },
    {
      "id": "stellen_verb",
      "cefr": "A2",
      "pos": "verb",
      "lemma_de": "stellen",
      "translations_en": ["to put, to place (upright)"],
      "example_de": "Sie stellt die Vase auf den Tisch.",
      "example_en": "She puts the vase on the table.",
      "cloze_word": "stellt",
      "themes": ["home"],
      "priority": 2,
      "verb": { "separable": false, "irregular": false, "present_3sg": "stellt", "perfekt": "hat gestellt", "praeteritum_3sg": null, "base_verb": null, "particle": null, "particle_meaning_hint": null }
    },
    {
      "id": "machen_verb",
      "cefr": "A2",
      "pos": "verb",
      "lemma_de": "machen",
      "translations_en": ["to make", "to do"],
      "example_de": "Was machst du gerade?",
      "example_en": "What are you doing right now?",
      "cloze_word": "machst",
      "themes": ["daily_routine"],
      "priority": 1,
      "verb": { "separable": false, "irregular": false, "present_3sg": "macht", "perfekt": "hat gemacht", "praeteritum_3sg": null, "base_verb": null, "particle": null, "particle_meaning_hint": null }
    },
    {
      "id": "halten_verb",
      "cefr": "A2",
      "pos": "verb",
      "lemma_de": "halten",
      "translations_en": ["to hold"],
      "example_de": "Er hält das Baby im Arm.",
      "example_en": "He is holding the baby in his arms.",
      "cloze_word": "hält",
      "themes": ["body_health"],
      "priority": 2,
      "verb": { "separable": false, "irregular": true, "present_3sg": "hält", "perfekt": "hat gehalten", "praeteritum_3sg": "hielt", "base_verb": null, "particle": null, "particle_meaning_hint": null }
    }
  ]
}
