{
  "schemaVersion": 1,
  "cefr": "B2",
  "pos": "verb",
  "entries": [
    { "id": "beruecksichtigen_verb", "cefr": "B2", "pos": "verb", "lemma_de": "berücksichtigen", "translations_en": ["to take into account", "to consider"], "example_de": "Wir müssen alle Faktoren berücksichtigen.", "example_en": "We need to take all factors into account.", "cloze_word": "berücksichtigen", "themes": ["work"], "priority": 1, "verb": { "separable": false, "irregular": false, "present_3sg": "berücksichtigt", "perfekt": "hat berücksichtigt", "praeteritum_3sg": null, "base_verb": null, "particle": null, "particle_meaning_hint": null } },
    { "id": "gewaehrleisten_verb", "cefr": "B2", "pos": "verb", "lemma_de": "gewährleisten", "translations_en": ["to ensure", "to guarantee"], "example_de": "Die Firma muss die Qualität gewährleisten.", "example_en": "The company must ensure quality.", "cloze_word": "gewährleisten", "themes": ["work"], "priority": 2, "verb": { "separable": false, "irregular": false, "present_3sg": "gewährleistet", "perfekt": "hat gewährleistet", "praeteritum_3sg": null, "base_verb": null, "particle": null, "particle_meaning_hint": null } },
    { "id": "beziehen_verb", "cefr": "B2", "pos": "verb", "lemma_de": "sich beziehen auf", "translations_en": ["to refer to"], "example_de": "Diese Zahl bezieht sich auf das letzte Jahr.", "example_en": "This number refers to last year.", "cloze_word": "bezieht", "themes": ["communication"], "priority": 2, "verb": { "separable": false, "irregular": true, "present_3sg": "bezieht sich", "perfekt": "hat sich bezogen", "praeteritum_3sg": "bezog sich", "base_verb": null, "particle": null, "particle_meaning_hint": null } },
    { "id": "betreffen_verb", "cefr": "B2", "pos": "verb", "lemma_de": "betreffen", "translations_en": ["to concern", "to affect"], "example_de": "Das betrifft uns alle.", "example_en": "That concerns all of us.", "cloze_word": "betrifft", "themes": ["abstract_ideas"], "priority": 1, "verb": { "separable": false, "irregular": true, "present_3sg": "betrifft", "perfekt": "hat betroffen", "praeteritum_3sg": "betraf", "base_verb": null, "particle": null, "particle_meaning_hint": null } },
    { "id": "verfuegen_verb", "cefr": "B2", "pos": "verb", "lemma_de": "verfügen über", "translations_en": ["to have at one's disposal"], "example_de": "Das Unternehmen verfügt über viel Erfahrung.", "example_en": "The company has a lot of experience at its disposal.", "cloze_word": "verfügt", "themes": ["work"], "priority": 3, "verb": { "separable": false, "irregular": false, "present_3sg": "verfügt", "perfekt": "hat verfügt", "praeteritum_3sg": null, "base_verb": null, "particle": null, "particle_meaning_hint": null } },
    { "id": "erfordern_verb", "cefr": "B2", "pos": "verb", "lemma_de": "erfordern", "translations_en": ["to require"], "example_de": "Diese Aufgabe erfordert viel Geduld.", "example_en": "This task requires a lot of patience.", "cloze_word": "erfordert", "themes": ["work"], "priority": 1, "verb": { "separable": false, "irregular": false, "present_3sg": "erfordert", "perfekt": "hat erfordert", "praeteritum_3sg": null, "base_verb": null, "particle": null, "particle_meaning_hint": null } }
  ]
}
